{
  "metadata": {
    "blueprintId": "test-minimal",
    "blueprintName": "Minimal Test Blueprint",
    "description": "A minimal blueprint for testing purposes",
    "version": "1.0.0",
    "author": "Test Suite",
    "tags": ["test", "minimal"]
  },
  "stack": {
    "primaryLanguage": "python",
    "frameworks": [
      {"name": "pytest", "version": "7.0+", "purpose": "Testing"}
    ],
    "databases": [],
    "tools": [],
    "styleGuides": []
  },
  "agents": [
    {"patternId": "code-reviewer", "required": true}
  ],
  "skills": [
    {"patternId": "bugfix-workflow", "required": true}
  ],
  "knowledge": [],
  "templates": {},
  "workflows": [],
  "mcpServers": [],
  "projectStructure": {
    "directories": [
      {"path": ".cursor/agents/", "purpose": "AI agent definitions"},
      {"path": ".cursor/skills/", "purpose": "Reusable skills"},
      {"path": "src/", "purpose": "Source code"},
      {"path": "tests/", "purpose": "Test files"}
    ],
    "files": [
      {"path": ".cursorrules", "purpose": "Agent behavior rules"},
      {"path": "README.md", "purpose": "Project documentation"}
    ]
  },
  "cursorrules": {
    "variables": [
      {"name": "PYTHON_PATH", "description": "Python executable path", "default": "python"}
    ],
    "rules": [
      {"name": "Testing", "description": "Use pytest for testing"}
    ]
  }
}
