{
  "metadata": {
    "blueprintId": "python-deep-learning",
    "blueprintName": "Python Deep Learning Blueprint",
    "description": "Deep learning projects with PyTorch, Hugging Face Transformers, and production training patterns",
    "version": "1.0.0",
    "author": "Cursor Agent Factory",
    "tags": ["python", "deep-learning", "pytorch", "transformers", "huggingface", "training"],
    "purpose": "Enable development of deep learning models with modern frameworks, distributed training, and deployment"
  },
  "stack": {
    "primaryLanguage": "python",
    "frameworks": [
      {"name": "PyTorch", "version": "2.0+", "purpose": "Deep learning framework"},
      {"name": "Transformers", "version": "4.30+", "purpose": "Hugging Face models"},
      {"name": "Datasets", "version": "2.14+", "purpose": "Hugging Face datasets"},
      {"name": "Accelerate", "version": "0.21+", "purpose": "Distributed training"},
      {"name": "PEFT", "version": "0.5+", "purpose": "Parameter-efficient fine-tuning", "optional": true},
      {"name": "Lightning", "version": "2.0+", "purpose": "Training framework", "optional": true},
      {"name": "TensorBoard", "version": "2.14+", "purpose": "Training visualization"}
    ],
    "databases": [
      {"type": "tracking", "name": "MLflow", "purpose": "Experiment tracking"},
      {"type": "tracking", "name": "Weights & Biases", "purpose": "Alternative tracking", "optional": true}
    ],
    "tools": [
      {"name": "pytest", "purpose": "Testing"},
      {"name": "ruff", "purpose": "Linting"},
      {"name": "black", "purpose": "Formatting"},
      {"name": "mypy", "purpose": "Type checking"},
      {"name": "tensorboard", "purpose": "Training visualization"},
      {"name": "huggingface-cli", "purpose": "Model hub CLI"}
    ],
    "styleGuides": [
      {"name": "pep8", "description": "PEP 8 Style Guide"},
      {"name": "google", "description": "Google Python Style"}
    ]
  },
  "agents": [
    {"patternId": "code-reviewer", "required": true, "customizations": {"skills": ["clean-code-review", "grounding"]}},
    {"patternId": "test-generator", "required": true, "customizations": {"skills": ["tdd"]}},
    {"patternId": "documentation-agent", "required": true}
  ],
  "skills": [
    {"patternId": "bugfix-workflow", "required": true},
    {"patternId": "feature-workflow", "required": true},
    {"patternId": "grounding", "required": true},
    {"patternId": "tdd", "required": true}
  ],
  "knowledge": [
    {"filename": "deep-learning-patterns.json", "description": "Training loops, optimization, checkpointing"},
    {"filename": "huggingface-patterns.json", "description": "Transformers, datasets, training"},
    {"filename": "mlops-patterns.json", "description": "Experiment tracking and deployment"}
  ],
  "templates": {
    "codeTemplates": [
      {"category": "model", "directory": "templates/python/models/"},
      {"category": "training", "directory": "templates/python/training/"},
      {"category": "dataset", "directory": "templates/python/datasets/"},
      {"category": "inference", "directory": "templates/python/inference/"}
    ],
    "documentTemplates": [
      {"name": "model_card.md", "directory": "templates/docs/"},
      {"name": "training_report.md", "directory": "templates/docs/"}
    ]
  },
  "projectStructure": {
    "directories": [
      {"path": ".cursor/agents/", "purpose": "AI agent definitions"},
      {"path": ".cursor/skills/", "purpose": "Reusable skills"},
      {"path": "src/", "purpose": "Source code"},
      {"path": "src/models/", "purpose": "Model architectures"},
      {"path": "src/data/", "purpose": "Data loading and processing"},
      {"path": "src/training/", "purpose": "Training logic"},
      {"path": "src/evaluation/", "purpose": "Evaluation metrics"},
      {"path": "src/inference/", "purpose": "Inference code"},
      {"path": "src/utils/", "purpose": "Utilities"},
      {"path": "configs/", "purpose": "Training configurations"},
      {"path": "scripts/", "purpose": "Training and eval scripts"},
      {"path": "data/", "purpose": "Data files"},
      {"path": "checkpoints/", "purpose": "Model checkpoints"},
      {"path": "outputs/", "purpose": "Training outputs"},
      {"path": "tests/", "purpose": "Test files"},
      {"path": "notebooks/", "purpose": "Exploration notebooks"}
    ],
    "files": [
      {"path": ".cursorrules", "purpose": "Agent behavior rules"},
      {"path": "README.md", "purpose": "Project documentation"},
      {"path": "pyproject.toml", "purpose": "Python project config"},
      {"path": "requirements.txt", "purpose": "Dependencies"},
      {"path": "train.py", "purpose": "Main training script"},
      {"path": "evaluate.py", "purpose": "Evaluation script"},
      {"path": "inference.py", "purpose": "Inference script"},
      {"path": "Dockerfile", "purpose": "Container definition"}
    ]
  },
  "cursorrules": {
    "variables": [
      {"name": "PYTHON_PATH", "description": "Python executable", "default": "python"},
      {"name": "HF_TOKEN", "description": "Hugging Face token", "default": ""},
      {"name": "CUDA_VISIBLE_DEVICES", "description": "GPU devices", "default": "0"}
    ],
    "rules": [
      {"name": "Mixed Precision", "description": "Use AMP for faster training"},
      {"name": "Gradient Checkpointing", "description": "Use for memory efficiency on large models"},
      {"name": "Reproducibility", "description": "Set all random seeds"},
      {"name": "Checkpointing", "description": "Save checkpoints every N steps"},
      {"name": "Logging", "description": "Log to TensorBoard and MLflow"},
      {"name": "Validation", "description": "Validate during training to detect overfitting"}
    ]
  }
}
